{
  "id": "mobile-default",
  "variant": "mobile",
  "theme": "auto",
  "layers": [
    {
      "name": "base",
      "rows": [
        {
          "height": 52,
          "slots": [
            { "keyId": "key-a", "width": 1 },
            { "keyId": "key-z", "width": 1 },
            { "keyId": "key-e", "width": 1 },
            { "keyId": "key-r", "width": 1 },
            { "keyId": "key-t", "width": 1 },
            { "keyId": "key-y", "width": 1 },
            { "keyId": "key-u", "width": 1 },
            { "keyId": "key-i", "width": 1 },
            { "keyId": "key-o", "width": 1 },
            { "keyId": "key-p", "width": 1 }
          ]
        },
        {
          "height": 52,
          "slots": [
            { "keyId": "key-q", "width": 1 },
            { "keyId": "key-s", "width": 1 },
            { "keyId": "key-d", "width": 1 },
            { "keyId": "key-f", "width": 1 },
            { "keyId": "key-g", "width": 1 },
            { "keyId": "key-h", "width": 1 },
            { "keyId": "key-j", "width": 1 },
            { "keyId": "key-k", "width": 1 },
            { "keyId": "key-l", "width": 1 },
            { "keyId": "key-m", "width": 1 }
          ]
        },
        {
          "height": 52,
          "slots": [
            { "keyId": "key-shift", "width": 1.5, "label": "⇧" },
            { "keyId": "key-w", "width": 1 },
            { "keyId": "key-x", "width": 1 },
            { "keyId": "key-c", "width": 1 },
            { "keyId": "key-v", "width": 1 },
            { "keyId": "key-b", "width": 1 },
            { "keyId": "key-n", "width": 1 },
            { "keyId": "key-e-dot", "width": 1 },
            { "keyId": "key-backspace", "width": 1.5, "label": "⌫" }
          ]
        },
        {
          "height": 56,
          "slots": [
            { "keyId": "key-o-dot", "width": 1 },
            { "keyId": "key-space", "width": 5 },
            { "keyId": "key-enter", "width": 2.5, "label": "⏎" }
          ]
        }
      ]
    },
    {
      "name": "shift",
      "rows": [
        {
          "height": 52,
          "slots": [
            { "keyId": "key-a-shift", "width": 1 },
            { "keyId": "key-z-shift", "width": 1 },
            { "keyId": "key-e-shift", "width": 1 },
            { "keyId": "key-r-shift", "width": 1 },
            { "keyId": "key-t-shift", "width": 1 },
            { "keyId": "key-y-shift", "width": 1 },
            { "keyId": "key-u-shift", "width": 1 },
            { "keyId": "key-i-shift", "width": 1 },
            { "keyId": "key-o-shift", "width": 1 },
            { "keyId": "key-p-shift", "width": 1 }
          ]
        },
        {
          "height": 52,
          "slots": [
            { "keyId": "key-q-shift", "width": 1 },
            { "keyId": "key-s-shift", "width": 1 },
            { "keyId": "key-d-shift", "width": 1 },
            { "keyId": "key-f-shift", "width": 1 },
            { "keyId": "key-g-shift", "width": 1 },
            { "keyId": "key-h-shift", "width": 1 },
            { "keyId": "key-j-shift", "width": 1 },
            { "keyId": "key-k-shift", "width": 1 },
            { "keyId": "key-l-shift", "width": 1 },
            { "keyId": "key-m-shift", "width": 1 }
          ]
        },
        {
          "height": 52,
          "slots": [
            { "keyId": "key-shift-shift", "width": 1.5, "label": "⇧" },
            { "keyId": "key-w-shift", "width": 1 },
            { "keyId": "key-x-shift", "width": 1 },
            { "keyId": "key-c-shift", "width": 1 },
            { "keyId": "key-v-shift", "width": 1 },
            { "keyId": "key-b-shift", "width": 1 },
            { "keyId": "key-n-shift", "width": 1 },
            { "keyId": "key-e-dot-shift", "width": 1 },
            { "keyId": "key-backspace-shift", "width": 1.5, "label": "⌫" }
          ]
        },
        {
          "height": 56,
          "slots": [
            { "keyId": "key-o-dot-shift", "width": 1 },
            { "keyId": "key-space-shift", "width": 5 },
            { "keyId": "key-enter-shift", "width": 2.5, "label": "⏎" }
          ]
        }
      ]
    }
  ]
}
